{
  "$schema":"https://json-schema.org/draft/2020-12/schema",
  "$id":"M5CBaselineCaptureContractV3",
  "type":"object",
  "additionalProperties":false,
  "required":["schema","baseline_id","status","typed_status","implementation_authorized","capture_must_be","source_run_id","baseline_receipt_path","baseline_receipt_sha256","required_paths","required_receipt_fields","comparison_fields","cache_on_rule","overwrite_policy","run_gate","claim_ceiling"],
  "properties":{
    "schema":{"const":"M5CBaselineCaptureContractV3"},
    "baseline_id":{"const":"M5C-R2-FROZEN-BASELINE-V3"},
    "status":{"const":"contract_only_not_captured"},
    "typed_status":{"const":"typed_absent"},
    "implementation_authorized":{"const":false},
    "capture_must_be":{"const":"fresh_unrepaired_sealed_baseline"},
    "source_run_id":{"type":["string","null"]},
    "baseline_receipt_path":{"type":["string","null"]},
    "baseline_receipt_sha256":{"type":["string","null"]},
    "required_paths":{"type":"array","minItems":1,"items":{"type":"string","minLength":1}},
    "required_receipt_fields":{"type":"array","minItems":1,"items":{"type":"string","minLength":1}},
    "comparison_fields":{"type":"array","minItems":1,"items":{"type":"string","minLength":1}},
    "cache_on_rule":{"type":"string","minLength":1},
    "overwrite_policy":{"type":"string","minLength":1},
    "run_gate":{"type":"string","minLength":1},
    "claim_ceiling":{"const":"screen_only; no performance or formal credit"}
  },
  "allOf":[
    {"if":{"properties":{"typed_status":{"const":"typed_absent"}},"required":["typed_status"]},"then":{"properties":{"status":{"const":"contract_only_not_captured"},"implementation_authorized":{"const":false},"source_run_id":{"type":"null"},"baseline_receipt_path":{"type":"null"},"baseline_receipt_sha256":{"type":"null"}}}}
  ]
}
