{
  "schema":"M5CBaselineCaptureContractV3","baseline_id":"M5C-R2-FROZEN-BASELINE-V3","status":"contract_only_not_captured","typed_status":"typed_absent","implementation_authorized":false,"capture_must_be":"fresh_unrepaired_sealed_baseline","source_run_id":null,"baseline_receipt_path":null,"baseline_receipt_sha256":null,"required_paths":["source_or_test/oracle/probe/core frozen input hashes","candidate-bound envelope bytes and sha256","profile and lane budget","baseline receipt","graph/usage/trace/witness/status fields"],"required_receipt_fields":["baseline_id","run_id","path","source_hash","program_bytes","program_sha256","envelope_bytes","envelope_sha256","profile_id","lane_budget","graph_hash","usage","trace","witness","result_status","receipt_sha256"],"comparison_fields":["artifact_bytes","artifact_sha256","result_status","tie_break","witness"],"cache_on_rule":"cache-on repaired output must match this baseline on every comparison field","overwrite_policy":"baseline is immutable; repaired implementation cannot overwrite it","run_gate":"typed_absent blocks run authorization and performance claims","claim_ceiling":"screen_only; no performance or formal credit"
}
